{
  "$schema": "https://json-schema.org/draft/2020-12/schema",
  "$id": "https://anvil.dev/schemas/v1/artifact.json",
  "title": "Anvil artifact (schema version 1)",
  "description": "Metadata for one bounded, hashed artifact attached to a run. Content is stored separately; artifacts carry SHA-256 hashes. Default maximum size is 8 MiB (enforced by ingest, not by this schema).",
  "type": "object",
  "additionalProperties": false,
  "required": [
    "schema_version",
    "artifact_id",
    "run_id",
    "name",
    "content_type",
    "size_bytes",
    "sha256",
    "created_at"
  ],
  "properties": {
    "schema_version": { "$ref": "defs.json#/$defs/schemaVersion" },
    "artifact_id": { "$ref": "defs.json#/$defs/uuidv7" },
    "run_id": { "$ref": "defs.json#/$defs/uuidv7" },
    "name": {
      "description": "Artifact file name. MUST be a plain name, not a path.",
      "type": "string",
      "minLength": 1,
      "maxLength": 255,
      "not": { "pattern": "[/\\\\]|^\\.|\\x00" }
    },
    "content_type": {
      "description": "IANA media type of the artifact content.",
      "type": "string",
      "minLength": 1
    },
    "size_bytes": {
      "type": "integer",
      "minimum": 0
    },
    "sha256": { "$ref": "defs.json#/$defs/sha256" },
    "created_at": { "$ref": "defs.json#/$defs/timestamp" },
    "event_id": {
      "description": "Event that produced this artifact, when known.",
      "$ref": "defs.json#/$defs/uuidv7"
    }
  }
}
