{
  "schema_version": "1",
  "artifact_id": "0190a8b0-7000-7a00-8000-000000000201",
  "run_id": "0190a8b0-7000-7a00-8000-000000000001",
  "name": "screenshot.png",
  "content_type": "image/png",
  "size_bytes": 102400,
  "sha256": "e3b0c44298fc1c149afbf4c8996fb92427ae41e4649b934ca495991b7852b855",
  "created_at": "2026-01-01T12:00:03.000Z",
  "event_id": "0190a8b0-7c3d-7f2e-8a1b-2c3d4e5f6072"
}
